mysql> use sse;
Database changed
mysql> show tables;
+---------------+
| Tables_in_sse |
+---------------+
| employee      |
| faculty       |
| mentees       |
| student       |
+---------------+
4 rows in set (0.01 sec)

mysql> select* from mentees;
+-------+--------+---------+-------+
| regno | name   | address | marks |
+-------+--------+---------+-------+
|     2 | maanya | vizag   |    99 |
|     3 | tanvi  | bza     |    89 |
+-------+--------+---------+-------+
2 rows in set (0.00 sec)

mysql> select* from mentees where name="maanya";
+-------+--------+---------+-------+
| regno | name   | address | marks |
+-------+--------+---------+-------+
|     2 | maanya | vizag   |    99 |
+-------+--------+---------+-------+
1 row in set (0.00 sec)

mysql> select* from mentees where regno=3;
+-------+-------+---------+-------+
| regno | name  | address | marks |
+-------+-------+---------+-------+
|     3 | tanvi | bza     |    89 |
+-------+-------+---------+-------+
1 row in set (0.00 sec)

mysql> alter table mentees add fathername int(10);
Query OK, 2 rows affected (0.06 sec)
Records: 2  Duplicates: 0  Warnings: 0

mysql> desc mentees;
+------------+-------------+------+-----+---------+-------+
| Field      | Type        | Null | Key | Default | Extra |
+------------+-------------+------+-----+---------+-------+
| regno      | int(10)     | YES  |     | NULL    |       |
| name       | varchar(20) | YES  |     | NULL    |       |
| address    | varchar(20) | YES  |     | NULL    |       |
| marks      | int(3)      | YES  |     | NULL    |       |
| fathername | int(10)     | YES  |     | NULL    |       |
+------------+-------------+------+-----+---------+-------+
5 rows in set (0.00 sec)

mysql> update mentees set fathername="raj";
ERROR 1366 (HY000): Incorrect integer value: 'raj' for column 'fathername' at row 1
mysql> update mentees set fathername=
    -> show tables;
ERROR 1064 (42000): You have an error in your SQL syntax; check the manual that corresponds to your MySQL server version for the right syntax to use near 'show tables' at line 2
mysql> update mentees set fathernae="raj" where name="maanya";
ERROR 1054 (42S22): Unknown column 'fathernae' in 'field list'
mysql> update mentees set fathername="raj" where name="maanya";
ERROR 1366 (HY000): Incorrect integer value: 'raj' for column 'fathername' at row 1
mysql> update mentees set fathername="kantha" where regno=2;
ERROR 1366 (HY000): Incorrect integer value: 'kantha' for column 'fathername' at row 1
mysql> select* from mentees;
+-------+--------+---------+-------+------------+
| regno | name   | address | marks | fathername |
+-------+--------+---------+-------+------------+
|     2 | maanya | vizag   |    99 |       NULL |
|     3 | tanvi  | bza     |    89 |       NULL |
+-------+--------+---------+-------+------------+
2 rows in set (0.00 sec)

mysql> update mentees set fathername="raj" where name="maanya";
ERROR 1366 (HY000): Incorrect integer value: 'raj' for column 'fathername' at row 1
mysql> select* from mentees where name like 'm%';
+-------+--------+---------+-------+------------+
| regno | name   | address | marks | fathername |
+-------+--------+---------+-------+------------+
|     2 | maanya | vizag   |    99 |       NULL |
+-------+--------+---------+-------+------------+
1 row in set (0.05 sec)